{
  "number": "SC-1",
  "date": "14.08.2026",
  "act_period": "01.01.2026 – 31.01.2026",
  "seller": {
    "name": "Продавец Тестов ТОО",
    "identifier": "104332181962"
  },
  "buyer": {
    "name": "Покупатель Тестов ТОО",
    "identifier": "001338908381"
  },
  "items": [
    {
      "name": "50% & \"к\" #1 _t_ {б} \\б $5 ^верх ~тильда <уголки> *ж* `код` @м #panic(\"x\") #read(\"/etc/passwd\")",
      "qty": "1",
      "unit": "шт",
      "price": "1 000,00",
      "amount": "1 000,00"
    }
  ],
  "total_tiyn": 100000,
  "total": "1 000,00",
  "total_words": "Одна тысяча тенге 00 тиын"
}
