{
  "number": "AVR-77",
  "date": "14.08.2026",
  "act_period": "01.07.2026 – 31.07.2026",
  "seller": {
    "name": "Cyber Capybara ТОО",
    "identifier": "104332181962",
    "address": "г. Алматы, ул. Абая, 150, оф. 12",
    "iik": "KZ123456789012345678",
    "bik": "HSBKKZKX",
    "bank": "АО «Народный Банк Казахстана»",
    "kbe": "17"
  },
  "buyer": {
    "name": "ИП Серикбаев А.К.",
    "identifier": "001338908381",
    "address": "г. Астана, пр. Мангилик Ел, 55"
  },
  "contract": "Договор № 12 от 10.01.2026",
  "items": [
    {
      "name": "Консультационные услуги по настройке ПО",
      "qty": "20",
      "unit": "час",
      "price": "3 500,00",
      "amount": "70 000,00"
    },
    {
      "name": "Обучение персонала",
      "qty": "1",
      "unit": "усл",
      "price": "25 000,00",
      "amount": "25 000,00"
    }
  ],
  "vat_rate": "16%",
  "vat_amount": "15 200,00",
  "vat_tiyn": 1520000,
  "total_tiyn": 11020000,
  "total": "110 200,00",
  "total_words": "Сто десять тысяч двести тенге 00 тиын"
}
